{
  "contract": {
    "kind": "transport",
    "operation": "http_client_request"
  },
  "controls": {
    "clock": "not used",
    "notes": [
      "local primp.Client double; no socket or proxy connection"
    ],
    "random": "not used"
  },
  "fixture_id": "transport.constructor-default-get",
  "input": {
    "constructor": {},
    "failure": null,
    "method": "GET"
  },
  "redaction": {
    "rules": [
      "synthetic inputs and responses",
      "no external request",
      "no credentials or live session cookies"
    ],
    "sanitized": true
  },
  "result": {
    "output": {
      "content_hex": "7472616e73706f72742066697874757265206279746573",
      "status": 201,
      "text": "transport fixture text"
    },
    "status": "ok"
  },
  "schema_version": 1,
  "source": {
    "commit": "a12929a72429a39a0841c3d7caacb20ee17acd4d",
    "package_version": "9.14.4",
    "python": "3.12.3",
    "reference_environment": "docs/reference-environment.md",
    "resolved_packages": {
      "anyio": "4.14.2",
      "brotli": "1.2.0",
      "certifi": "2026.6.17",
      "click": "8.4.2",
      "ddgs": "9.14.4",
      "fake-useragent": "2.2.0",
      "h11": "0.16.0",
      "h2": "4.3.0",
      "hpack": "4.2.0",
      "httpcore": "1.0.9",
      "httpx": "0.28.1",
      "hyperframe": "6.1.0",
      "idna": "3.18",
      "lxml": "6.1.1",
      "primp": "1.3.1",
      "socksio": "1.0.0",
      "typing-extensions": "4.16.0"
    }
  },
  "trace": [
    {
      "kind": "note",
      "note": "primp.Client constructor",
      "sequence": 1,
      "value": {
        "ca_cert_file": null,
        "impersonate": "random",
        "impersonate_os": "random",
        "proxy": null,
        "timeout": 10,
        "verify": true
      }
    },
    {
      "cookie_order": [
        "fixture_cookie"
      ],
      "cookies": {
        "fixture_cookie": "value"
      },
      "kind": "request",
      "method": "GET",
      "query": {
        "q": "needle"
      },
      "sequence": 2,
      "url": "https://transport.fixture/request"
    },
    {
      "content_hex": "7472616e73706f72742066697874757265206279746573",
      "kind": "response",
      "sequence": 3,
      "status": 201,
      "text": "transport fixture text"
    }
  ]
}
