{
  "contract": {
    "category": "text",
    "engine": "yandex",
    "kind": "engine",
    "operation": "search_twice"
  },
  "controls": {
    "clock": "not used",
    "notes": [
      "source Yandex searchid is request-time random rather than module-lifetime state"
    ],
    "random": "randint is invoked for every source payload build"
  },
  "fixture_id": "engine.text.yandex-searchid-per-search",
  "input": {
    "calls": [
      {
        "page": 1,
        "query": "fixture yandex first",
        "region": "us-en",
        "safesearch": "moderate",
        "timelimit": null
      },
      {
        "page": 2,
        "query": "fixture yandex second",
        "region": "us-en",
        "safesearch": "moderate",
        "timelimit": null
      }
    ]
  },
  "redaction": {
    "rules": [
      "synthetic inputs and responses",
      "no external request",
      "no credentials or live session cookies"
    ],
    "sanitized": true
  },
  "result": {
    "output": {
      "results": [
        [],
        []
      ]
    },
    "status": "ok"
  },
  "schema_version": 1,
  "source": {
    "commit": "a12929a72429a39a0841c3d7caacb20ee17acd4d",
    "package_version": "9.14.4",
    "python": "3.12.3",
    "reference_environment": "docs/reference-environment.md",
    "resolved_packages": {
      "anyio": "4.14.2",
      "brotli": "1.2.0",
      "certifi": "2026.6.17",
      "click": "8.4.2",
      "ddgs": "9.14.4",
      "fake-useragent": "2.2.0",
      "h11": "0.16.0",
      "h2": "4.3.0",
      "hpack": "4.2.0",
      "httpcore": "1.0.9",
      "httpx": "0.28.1",
      "hyperframe": "6.1.0",
      "idna": "3.18",
      "lxml": "6.1.1",
      "primp": "1.3.1",
      "socksio": "1.0.0",
      "typing-extensions": "4.16.0"
    }
  },
  "trace": [
    {
      "kind": "random",
      "sequence": 1,
      "value": {
        "function": "randint",
        "lower": 1000000,
        "upper": 9999999,
        "value": 1111111
      }
    },
    {
      "kind": "request",
      "method": "GET",
      "query": {
        "searchid": "1111111",
        "text": "fixture yandex first",
        "web": "1"
      },
      "query_order": [
        "text",
        "web",
        "searchid"
      ],
      "sequence": 2,
      "url": "https://yandex.com/search/site/"
    },
    {
      "content_hex": "3c68746d6c3e3c626f64793e3c2f626f64793e3c2f68746d6c3e",
      "kind": "response",
      "sequence": 3,
      "status": 200,
      "text": "<html><body></body></html>"
    },
    {
      "kind": "random",
      "sequence": 4,
      "value": {
        "function": "randint",
        "lower": 1000000,
        "upper": 9999999,
        "value": 2222222
      }
    },
    {
      "kind": "request",
      "method": "GET",
      "query": {
        "p": "1",
        "searchid": "2222222",
        "text": "fixture yandex second",
        "web": "1"
      },
      "query_order": [
        "text",
        "web",
        "searchid",
        "p"
      ],
      "sequence": 5,
      "url": "https://yandex.com/search/site/"
    },
    {
      "content_hex": "3c68746d6c3e3c626f64793e3c2f626f64793e3c2f68746d6c3e",
      "kind": "response",
      "sequence": 6,
      "status": 200,
      "text": "<html><body></body></html>"
    }
  ]
}
