{
  "contract": {
    "category": "text",
    "engine": "mojeek",
    "kind": "engine",
    "operation": "search"
  },
  "controls": {
    "clock": "not used",
    "notes": [
      "source BaseSearchEngine treats exactly empty HTTP-200 text as None"
    ],
    "random": "not used"
  },
  "fixture_id": "engine.text.mojeek-empty-text-200-none",
  "input": {
    "page": 1,
    "query": "fixture empty body mojeek",
    "region": "us-en",
    "safesearch": "moderate",
    "timelimit": null
  },
  "redaction": {
    "rules": [
      "synthetic inputs and responses",
      "no external request",
      "no credentials or live session cookies"
    ],
    "sanitized": true
  },
  "result": {
    "output": null,
    "status": "ok"
  },
  "schema_version": 1,
  "source": {
    "commit": "a12929a72429a39a0841c3d7caacb20ee17acd4d",
    "package_version": "9.14.4",
    "python": "3.12.3",
    "reference_environment": "docs/reference-environment.md",
    "resolved_packages": {
      "anyio": "4.14.2",
      "brotli": "1.2.0",
      "certifi": "2026.6.17",
      "click": "8.4.2",
      "ddgs": "9.14.4",
      "fake-useragent": "2.2.0",
      "h11": "0.16.0",
      "h2": "4.3.0",
      "hpack": "4.2.0",
      "httpcore": "1.0.9",
      "httpx": "0.28.1",
      "hyperframe": "6.1.0",
      "idna": "3.18",
      "lxml": "6.1.1",
      "primp": "1.3.1",
      "socksio": "1.0.0",
      "typing-extensions": "4.16.0"
    }
  },
  "trace": [
    {
      "cookie_order": [
        "arc",
        "lb"
      ],
      "cookies": {
        "arc": "us",
        "lb": "en"
      },
      "kind": "cookie",
      "sequence": 1,
      "url": "https://www.mojeek.com"
    },
    {
      "kind": "request",
      "method": "GET",
      "query": {
        "q": "fixture empty body mojeek"
      },
      "query_order": [
        "q"
      ],
      "sequence": 2,
      "url": "https://www.mojeek.com/search"
    },
    {
      "content_hex": "",
      "kind": "response",
      "sequence": 3,
      "status": 200,
      "text": ""
    }
  ]
}
