{
  "contract": {
    "category": "images",
    "engine": "bing",
    "kind": "parser",
    "operation": "json_loads"
  },
  "controls": {
    "clock": "not used",
    "notes": [
      "Bing Images applies json.loads to the HTML m attribute before selecting metadata fields."
    ],
    "random": "not used"
  },
  "fixture_id": "parser.images.bing-metadata-json-mixed",
  "input": {
    "json": "{\n              \"t\": \"Fixture Bing Image\",\n              \"murl\": null,\n              \"turl\": \"https://bing-image.fixture/thumb\",\n              \"purl\": \"https://bing-page.fixture/page\",\n              \"width\": 640,\n              \"height\": 480,\n              \"flags\": [true, null],\n              \"nested\": {\"ratio\": 1.5}\n            }"
  },
  "redaction": {
    "rules": [
      "synthetic inputs and responses",
      "no external request",
      "no credentials or live session cookies"
    ],
    "sanitized": true
  },
  "result": {
    "output": {
      "flags": [
        true,
        null
      ],
      "height": 480,
      "murl": null,
      "nested": {
        "ratio": 1.5
      },
      "purl": "https://bing-page.fixture/page",
      "t": "Fixture Bing Image",
      "turl": "https://bing-image.fixture/thumb",
      "width": 640
    },
    "status": "ok"
  },
  "schema_version": 1,
  "source": {
    "commit": "a12929a72429a39a0841c3d7caacb20ee17acd4d",
    "package_version": "9.14.4",
    "python": "3.12.3",
    "reference_environment": "docs/reference-environment.md",
    "resolved_packages": {
      "anyio": "4.14.2",
      "brotli": "1.2.0",
      "certifi": "2026.6.17",
      "click": "8.4.2",
      "ddgs": "9.14.4",
      "fake-useragent": "2.2.0",
      "h11": "0.16.0",
      "h2": "4.3.0",
      "hpack": "4.2.0",
      "httpcore": "1.0.9",
      "httpx": "0.28.1",
      "hyperframe": "6.1.0",
      "idna": "3.18",
      "lxml": "6.1.1",
      "primp": "1.3.1",
      "socksio": "1.0.0",
      "typing-extensions": "4.16.0"
    }
  },
  "trace": []
}
