{
  "contract": {
    "kind": "pure",
    "operation": "google_user_agent"
  },
  "controls": {
    "clock": "not used",
    "notes": [
      "source get_ua is evaluated for class-level headers, not per search request"
    ],
    "random": "synthetic SystemRandom chooses first device and lower inclusive values"
  },
  "fixture_id": "pure.google-module-lifetime-user-agent-shape",
  "input": {
    "device_index": 0,
    "random_values": [
      39,
      1000,
      1000
    ]
  },
  "redaction": {
    "rules": [
      "synthetic inputs",
      "no external request",
      "no credentials or cookies"
    ],
    "sanitized": true
  },
  "result": {
    "output": "Mozilla/5.0 (Linux; Android 5.0; SM-G900P Build/LRX21T) AppleWebKit/537.36 (KHTML, like Gecko) Chrome/39.0.1000.1000 Mobile Safari/537.36NSTNWV",
    "status": "ok"
  },
  "schema_version": 1,
  "source": {
    "commit": "a12929a72429a39a0841c3d7caacb20ee17acd4d",
    "package_version": "9.14.4",
    "python": "3.12.3",
    "reference_environment": "docs/reference-environment.md",
    "resolved_packages": {
      "anyio": "4.14.2",
      "brotli": "1.2.0",
      "certifi": "2026.6.17",
      "click": "8.4.2",
      "ddgs": "9.14.4",
      "fake-useragent": "2.2.0",
      "h11": "0.16.0",
      "h2": "4.3.0",
      "hpack": "4.2.0",
      "httpcore": "1.0.9",
      "httpx": "0.28.1",
      "hyperframe": "6.1.0",
      "idna": "3.18",
      "lxml": "6.1.1",
      "primp": "1.3.1",
      "socksio": "1.0.0",
      "typing-extensions": "4.16.0"
    }
  },
  "trace": [
    {
      "kind": "random",
      "sequence": 1,
      "value": {
        "function": "choice",
        "index": 0
      }
    },
    {
      "kind": "random",
      "sequence": 2,
      "value": {
        "function": "randint",
        "value": 39
      }
    },
    {
      "kind": "random",
      "sequence": 3,
      "value": {
        "function": "randint",
        "value": 1000
      }
    },
    {
      "kind": "random",
      "sequence": 4,
      "value": {
        "function": "randint",
        "value": 1000
      }
    }
  ]
}
