{
  "contract": {
    "category": "text",
    "engine": "grokipedia",
    "kind": "engine",
    "operation": "search"
  },
  "controls": {
    "clock": "not used",
    "notes": [
      "The slug is interpolated with a Python f-string, so JSON null becomes the literal None path segment."
    ],
    "random": "not used"
  },
  "fixture_id": "engine.text.grokipedia-null-slug-python-string",
  "input": {
    "page": 0,
    "query": "fixture grokipedia first result",
    "region": "US-en",
    "safesearch": "strict",
    "timelimit": ""
  },
  "redaction": {
    "rules": [
      "synthetic inputs and responses",
      "no external request",
      "no credentials or live session cookies"
    ],
    "sanitized": true
  },
  "result": {
    "field_order": [
      [
        "title",
        "href",
        "body"
      ]
    ],
    "output": [
      {
        "body": "",
        "href": "https://grokipedia.com/page/None",
        "title": "fixture"
      }
    ],
    "status": "ok"
  },
  "schema_version": 1,
  "source": {
    "commit": "a12929a72429a39a0841c3d7caacb20ee17acd4d",
    "package_version": "9.14.4",
    "python": "3.12.3",
    "reference_environment": "docs/reference-environment.md",
    "resolved_packages": {
      "anyio": "4.14.2",
      "brotli": "1.2.0",
      "certifi": "2026.6.17",
      "click": "8.4.2",
      "ddgs": "9.14.4",
      "fake-useragent": "2.2.0",
      "h11": "0.16.0",
      "h2": "4.3.0",
      "hpack": "4.2.0",
      "httpcore": "1.0.9",
      "httpx": "0.28.1",
      "hyperframe": "6.1.0",
      "idna": "3.18",
      "lxml": "6.1.1",
      "primp": "1.3.1",
      "socksio": "1.0.0",
      "typing-extensions": "4.16.0"
    }
  },
  "trace": [
    {
      "kind": "request",
      "method": "GET",
      "query": {
        "limit": "1",
        "query": "fixture grokipedia first result"
      },
      "query_order": [
        "query",
        "limit"
      ],
      "sequence": 1,
      "url": "https://grokipedia.com/api/typeahead"
    },
    {
      "content_hex": "7b22726573756c7473223a205b7b227469746c65223a202266697874757265222c2022736c7567223a206e756c6c7d5d7d",
      "kind": "response",
      "sequence": 2,
      "status": 200,
      "text": "{\"results\": [{\"title\": \"fixture\", \"slug\": null}]}"
    }
  ]
}
