{
  "contract": {
    "kind": "pure",
    "operation": "duckduckgo_videos_extract_results"
  },
  "controls": {
    "clock": "not used",
    "random": "not used"
  },
  "fixture_id": "pure.video-heterogeneous-values",
  "input": {
    "response": {
      "results": [
        {
          "content": null,
          "description": 17,
          "duration": 123,
          "embed_html": "<iframe src='https://embed.example'></iframe>",
          "embed_url": "https://embed.example/path",
          "image_token": {
            "opaque": "token"
          },
          "images": {
            "flag": true,
            "large": "https://image.example/large",
            "width": 1280
          },
          "provider": [
            "provider",
            2
          ],
          "published": false,
          "publisher": null,
          "statistics": {
            "empty": null,
            "ratio": 1.25,
            "viewCount": 29059
          },
          "title": "  Video​ title  ",
          "uploader": [
            "alice",
            null
          ]
        }
      ]
    }
  },
  "redaction": {
    "rules": [
      "synthetic inputs",
      "no external request",
      "no credentials or cookies"
    ],
    "sanitized": true
  },
  "result": {
    "field_order": [
      [
        "title",
        "content",
        "description",
        "duration",
        "embed_html",
        "embed_url",
        "image_token",
        "images",
        "provider",
        "published",
        "publisher",
        "statistics",
        "uploader"
      ]
    ],
    "output": [
      {
        "content": null,
        "description": 17,
        "duration": 123,
        "embed_html": "<iframe src='https://embed.example'></iframe>",
        "embed_url": "https://embed.example/path",
        "image_token": {
          "opaque": "token"
        },
        "images": {
          "flag": true,
          "large": "https://image.example/large",
          "width": 1280
        },
        "provider": [
          "provider",
          2
        ],
        "published": false,
        "publisher": null,
        "statistics": {
          "empty": null,
          "ratio": 1.25,
          "viewCount": 29059
        },
        "title": "Video title",
        "uploader": [
          "alice",
          null
        ]
      }
    ],
    "status": "ok"
  },
  "schema_version": 1,
  "source": {
    "commit": "a12929a72429a39a0841c3d7caacb20ee17acd4d",
    "package_version": "9.14.4",
    "python": "3.12.3",
    "reference_environment": "docs/reference-environment.md",
    "resolved_packages": {
      "anyio": "4.14.2",
      "brotli": "1.2.0",
      "certifi": "2026.6.17",
      "click": "8.4.2",
      "ddgs": "9.14.4",
      "fake-useragent": "2.2.0",
      "h11": "0.16.0",
      "h2": "4.3.0",
      "hpack": "4.2.0",
      "httpcore": "1.0.9",
      "httpx": "0.28.1",
      "hyperframe": "6.1.0",
      "idna": "3.18",
      "lxml": "6.1.1",
      "primp": "1.3.1",
      "socksio": "1.0.0",
      "typing-extensions": "4.16.0"
    }
  },
  "trace": []
}
