{
  "contract": {
    "category": "images",
    "engine": "bing",
    "kind": "engine",
    "operation": "search"
  },
  "controls": {
    "clock": "not used",
    "notes": [
      "Python int() accepts Unicode decimal digits, Unicode surrounding whitespace, and a single digit separator."
    ],
    "random": "not used"
  },
  "fixture_id": "engine.images.bing-unicode-underscore-engine-max-results",
  "input": {
    "max_results": " ١_٠ ",
    "page": 2,
    "query": "fixture bing minimum count",
    "region": "us-en",
    "safesearch": "moderate",
    "timelimit": null
  },
  "redaction": {
    "rules": [
      "synthetic inputs and responses",
      "no external request",
      "no credentials or live session cookies"
    ],
    "sanitized": true
  },
  "result": {
    "field_order": [],
    "output": [],
    "status": "ok"
  },
  "schema_version": 1,
  "source": {
    "commit": "a12929a72429a39a0841c3d7caacb20ee17acd4d",
    "package_version": "9.14.4",
    "python": "3.12.3",
    "reference_environment": "docs/reference-environment.md",
    "resolved_packages": {
      "anyio": "4.14.2",
      "brotli": "1.2.0",
      "certifi": "2026.6.17",
      "click": "8.4.2",
      "ddgs": "9.14.4",
      "fake-useragent": "2.2.0",
      "h11": "0.16.0",
      "h2": "4.3.0",
      "hpack": "4.2.0",
      "httpcore": "1.0.9",
      "httpx": "0.28.1",
      "hyperframe": "6.1.0",
      "idna": "3.18",
      "lxml": "6.1.1",
      "primp": "1.3.1",
      "socksio": "1.0.0",
      "typing-extensions": "4.16.0"
    }
  },
  "trace": [
    {
      "kind": "request",
      "method": "GET",
      "query": {
        "async": "1",
        "count": "35",
        "first": "36",
        "q": "fixture bing minimum count"
      },
      "query_order": [
        "q",
        "async",
        "first",
        "count"
      ],
      "sequence": 1,
      "url": "https://www.bing.com/images/async"
    },
    {
      "content_hex": "3c68746d6c3e3c626f64793e3c2f626f64793e3c2f68746d6c3e",
      "kind": "response",
      "sequence": 2,
      "status": 200,
      "text": "<html><body></body></html>"
    }
  ]
}
