{
  "contract": {
    "category": "images",
    "engine": "duckduckgo",
    "kind": "engine",
    "operation": "search"
  },
  "controls": {
    "clock": "not used",
    "notes": [
      "synthetic HTTP 200 parses to an empty list; this differs from the non-200 None contract"
    ],
    "random": "not used"
  },
  "fixture_id": "engine.images.duckduckgo-empty-200",
  "input": {
    "page": 1,
    "query": "fixture empty images duckduckgo",
    "region": "us-en",
    "safesearch": "moderate",
    "timelimit": null
  },
  "redaction": {
    "rules": [
      "synthetic inputs and responses",
      "no external request",
      "no credentials or live session cookies"
    ],
    "sanitized": true
  },
  "result": {
    "field_order": [],
    "output": [],
    "status": "ok"
  },
  "schema_version": 1,
  "source": {
    "commit": "a12929a72429a39a0841c3d7caacb20ee17acd4d",
    "package_version": "9.14.4",
    "python": "3.12.3",
    "reference_environment": "docs/reference-environment.md",
    "resolved_packages": {
      "anyio": "4.14.2",
      "brotli": "1.2.0",
      "certifi": "2026.6.17",
      "click": "8.4.2",
      "ddgs": "9.14.4",
      "fake-useragent": "2.2.0",
      "h11": "0.16.0",
      "h2": "4.3.0",
      "hpack": "4.2.0",
      "httpcore": "1.0.9",
      "httpx": "0.28.1",
      "hyperframe": "6.1.0",
      "idna": "3.18",
      "lxml": "6.1.1",
      "primp": "1.3.1",
      "socksio": "1.0.0",
      "typing-extensions": "4.16.0"
    }
  },
  "trace": [
    {
      "headers": {
        "Accept": "*/*",
        "Accept-Language": "en-US,en;q=0.5",
        "Connection": "keep-alive",
        "Priority": "u=4",
        "Referer": "https://duckduckgo.com/",
        "Sec-Fetch-Dest": "empty",
        "Sec-Fetch-Mode": "cors",
        "Sec-Fetch-Site": "same-origin",
        "Sec-GPC": "1"
      },
      "kind": "note",
      "note": "headers_update",
      "sequence": 1
    },
    {
      "kind": "request",
      "method": "GET",
      "query": {
        "q": "fixture empty images duckduckgo"
      },
      "sequence": 2,
      "url": "https://duckduckgo.com"
    },
    {
      "content_hex": "7671643d73796e7468657469632d76716426",
      "kind": "response",
      "sequence": 3,
      "status": 200,
      "text": ""
    },
    {
      "kind": "request",
      "method": "GET",
      "query": {
        "ct": "AT",
        "l": "us-en",
        "o": "json",
        "p": "1",
        "q": "fixture empty images duckduckgo",
        "vqd": "synthetic-vqd"
      },
      "sequence": 4,
      "url": "https://duckduckgo.com/i.js"
    },
    {
      "content_hex": "7b22726573756c7473223a205b5d7d",
      "kind": "response",
      "sequence": 5,
      "status": 200,
      "text": "{\"results\": []}"
    }
  ]
}
