{
  "contract": {
    "category": "text",
    "engine": "startpage",
    "kind": "engine",
    "operation": "search"
  },
  "controls": {
    "clock": "not used",
    "notes": [
      "BaseSearchEngine.request returns no text for synthetic HTTP 503; source search returns None"
    ],
    "random": "not used"
  },
  "fixture_id": "engine.text.startpage-non-200-none",
  "input": {
    "page": 1,
    "query": "fixture status startpage",
    "region": "us-en",
    "safesearch": "moderate",
    "timelimit": null
  },
  "redaction": {
    "rules": [
      "synthetic inputs and responses",
      "no external request",
      "no credentials or live session cookies"
    ],
    "sanitized": true
  },
  "result": {
    "output": null,
    "status": "ok"
  },
  "schema_version": 1,
  "source": {
    "commit": "a12929a72429a39a0841c3d7caacb20ee17acd4d",
    "package_version": "9.14.4",
    "python": "3.12.3",
    "reference_environment": "docs/reference-environment.md",
    "resolved_packages": {
      "anyio": "4.14.2",
      "brotli": "1.2.0",
      "certifi": "2026.6.17",
      "click": "8.4.2",
      "ddgs": "9.14.4",
      "fake-useragent": "2.2.0",
      "h11": "0.16.0",
      "h2": "4.3.0",
      "hpack": "4.2.0",
      "httpcore": "1.0.9",
      "httpx": "0.28.1",
      "hyperframe": "6.1.0",
      "idna": "3.18",
      "lxml": "6.1.1",
      "primp": "1.3.1",
      "socksio": "1.0.0",
      "typing-extensions": "4.16.0"
    }
  },
  "trace": [
    {
      "headers": {
        "Referer": "https://www.startpage.com/"
      },
      "kind": "note",
      "note": "headers_update",
      "sequence": 1
    },
    {
      "kind": "request",
      "method": "GET",
      "sequence": 2,
      "url": "https://www.startpage.com/"
    },
    {
      "content_hex": "3c666f726d2069643d22736561726368223e3c696e707574206e616d653d227363222076616c75653d2273796e7468657469632d7363223e3c2f666f726d3e",
      "kind": "response",
      "sequence": 3,
      "status": 200,
      "text": "<form id=\"search\"><input name=\"sc\" value=\"synthetic-sc\"></form>"
    },
    {
      "form": {
        "abd": "0",
        "abe": "0",
        "abp": "1",
        "cat": "web",
        "language": "english",
        "lui": "english",
        "qadf": "moderate",
        "qsr": "en_US",
        "query": "fixture status startpage",
        "sc": "synthetic-sc",
        "segment": "organic",
        "t": "device"
      },
      "form_order": [
        "query",
        "cat",
        "t",
        "sc",
        "lui",
        "language",
        "abp",
        "abd",
        "abe",
        "qsr",
        "qadf",
        "segment"
      ],
      "kind": "request",
      "method": "POST",
      "sequence": 4,
      "url": "https://www.startpage.com/sp/search"
    },
    {
      "content_hex": "73796e746865746963206e6f6e2d323030",
      "kind": "response",
      "sequence": 5,
      "status": 503,
      "text": "synthetic non-200"
    }
  ]
}
