{
  "contract": {
    "category": "news",
    "engine": "yahoo",
    "kind": "engine",
    "operation": "search"
  },
  "controls": {
    "clock": "datetime.now(timezone.utc) patched to 2024-04-05T06:07:08.987654+00:00",
    "notes": [
      "Yahoo runs unquote_plus before its BaseResult URL normalizer; %2520 is decoded twice while literal plus follows source plus handling."
    ],
    "random": "not used"
  },
  "fixture_id": "engine.news.yahoo-nested-percent-url",
  "input": {
    "page": 1,
    "query": "fixture yahoo nested percent",
    "region": "ignored-region",
    "safesearch": "ignored-safe",
    "timelimit": null
  },
  "redaction": {
    "rules": [
      "synthetic inputs and responses",
      "no external request",
      "no credentials or live session cookies"
    ],
    "sanitized": true
  },
  "result": {
    "field_order": [
      [
        "date",
        "title",
        "body",
        "url",
        "image",
        "source"
      ]
    ],
    "output": [
      {
        "body": "Fixture body",
        "date": "fixture date",
        "image": "fixture.jpg",
        "source": "Fixture source · via Yahoo",
        "title": "Fixture Yahoo nested",
        "url": "https://target.example/a+b+two"
      }
    ],
    "status": "ok"
  },
  "schema_version": 1,
  "source": {
    "commit": "a12929a72429a39a0841c3d7caacb20ee17acd4d",
    "package_version": "9.14.4",
    "python": "3.12.3",
    "reference_environment": "docs/reference-environment.md",
    "resolved_packages": {
      "anyio": "4.14.2",
      "brotli": "1.2.0",
      "certifi": "2026.6.17",
      "click": "8.4.2",
      "ddgs": "9.14.4",
      "fake-useragent": "2.2.0",
      "h11": "0.16.0",
      "h2": "4.3.0",
      "hpack": "4.2.0",
      "httpcore": "1.0.9",
      "httpx": "0.28.1",
      "hyperframe": "6.1.0",
      "idna": "3.18",
      "lxml": "6.1.1",
      "primp": "1.3.1",
      "socksio": "1.0.0",
      "typing-extensions": "4.16.0"
    }
  },
  "trace": [
    {
      "kind": "request",
      "method": "GET",
      "query": {
        "p": "fixture yahoo nested percent"
      },
      "query_order": [
        "p"
      ],
      "sequence": 1,
      "url": "https://news.search.yahoo.com/search"
    },
    {
      "content_hex": "0a2020202020202020202020202020202020202020202020203c68746d6c3e3c626f64793e3c6469762069643d22776562223e3c6c693e3c613e0a20202020202020202020202020202020202020202020202020203c7370616e20636c6173733d2274696d65223e6669787475726520646174653c2f7370616e3e3c68343e3c6120687265663d2268747470733a2f2f722e7365617263682e7961686f6f2e636f6d2f52553d68747470732533412532462532467461726765742e6578616d706c652532466125324262253235323074776f2f524b3d66697874757265223e46697874757265205961686f6f206e65737465643c2f613e3c2f68343e0a20202020202020202020202020202020202020202020202020203c703e4669787475726520626f64793c2f703e3c696d67207372633d2268747470733a2f2f696d6167652e6578616d706c652f2d2f666978747572652e6a706722202f3e0a20202020202020202020202020202020202020202020202020203c7370616e20636c6173733d22736f75726365223e4669787475726520736f7572636520c2b72020766961205961686f6f3c2f7370616e3e0a2020202020202020202020202020202020202020202020203c2f613e3c2f6c693e3c2f6469763e3c2f626f64793e3c2f68746d6c3e0a202020202020202020202020202020202020202020202020",
      "kind": "response",
      "sequence": 2,
      "status": 200,
      "text": "\n                        <html><body><div id=\"web\"><li><a>\n                          <span class=\"time\">fixture date</span><h4><a href=\"https://r.search.yahoo.com/RU=https%3A%2F%2Ftarget.example%2Fa%2Bb%2520two/RK=fixture\">Fixture Yahoo nested</a></h4>\n                          <p>Fixture body</p><img src=\"https://image.example/-/fixture.jpg\" />\n                          <span class=\"source\">Fixture source ·  via Yahoo</span>\n                        </a></li></div></body></html>\n                        "
    }
  ]
}
